{
  "$schema": "https://json-schema.org/draft/2020-12/schema",
  "$id": "https://fish-forecast-map.local/schemas/fish-species-ecology.v1.3.0.schema.json",
  "title": "Fish species ecology research record (expandable)",
  "type": "object",
  "additionalProperties": false,
  "required": ["schemaVersion", "speciesId", "identity", "researchScope", "ecology", "sources", "review"],
  "properties": {
    "schemaVersion": { "const": "1.3.0" },
    "speciesId": { "type": "string", "pattern": "^[a-z0-9][a-z0-9_-]*$" },
    "identity": {
      "type": "object", "additionalProperties": false,
      "required": ["displayNameJa", "canonicalNameJa", "scientificName", "aliases", "entityType", "note", "parentGroupId", "memberSpeciesIds"],
      "properties": {
        "displayNameJa": { "type": "string", "minLength": 1 },
        "canonicalNameJa": { "$ref": "#/$defs/textClaim" },
        "scientificName": { "$ref": "#/$defs/textClaim" },
        "aliases": { "type": "array", "items": { "type": "string" }, "uniqueItems": true },
        "entityType": { "enum": ["exact_species", "species_group", "squid_species", "cephalopod_species", "unknown"] },
        "note": { "type": "string" },
        "parentGroupId": { "type": ["string", "null"] },
        "memberSpeciesIds": { "type": "array", "items": { "type": "string", "pattern": "^[a-z0-9][a-z0-9_-]*$" }, "uniqueItems": true }
      }
    },
    "researchScope": {
      "type": "object", "additionalProperties": false,
      "required": ["targetArea", "checkedAt", "sourcePolicy"],
      "properties": {
        "targetArea": { "type": "string", "minLength": 1 },
        "checkedAt": { "type": "string", "format": "date" },
        "sourcePolicy": { "type": "string", "minLength": 1 }
      }
    },
    "ecology": {
      "type": "object", "additionalProperties": false,
      "required": ["stableGeneral", "regionalCatchability"],
      "properties": {
        "stableGeneral": { "$ref": "#/$defs/ecologyClaims" },
        "regionalCatchability": { "$ref": "#/$defs/ecologyClaims" }
      }
    },
    "sources": { "type": "array", "items": { "$ref": "#/$defs/source" } },
    "review": {
      "type": "object", "additionalProperties": false,
      "required": ["officialResearch", "secondaryResearch", "schemaValidation", "comparisonWithCurrentImplementation", "attributeDecisions", "reviewStatus", "productionAdoption"],
      "properties": {
        "officialResearch": { "type": "string" },
        "secondaryResearch": { "type": "string" },
        "schemaValidation": { "type": "string" },
        "comparisonWithCurrentImplementation": {
          "type": "object", "additionalProperties": false,
          "required": ["authoritativeComparisonDocument", "scoreV2Status", "inheritancePolicy"],
          "properties": {
            "authoritativeComparisonDocument": { "type": "string", "pattern": "^docs/research/[A-Za-z0-9_./-]+\\.md$" },
            "scoreV2Status": { "enum": ["supported", "unsupported"] },
            "inheritancePolicy": { "const": "do_not_inherit_between_species_or_group" }
          }
        },
        "attributeDecisions": { "type": "array", "items": { "$ref": "#/$defs/decision" } },
        "reviewStatus": { "enum": ["draft", "ready_for_review", "approved", "rejected"] },
        "productionAdoption": {
          "type": "object", "additionalProperties": false,
          "required": ["projectionPolicy", "acceptedPaths", "unknownPolicy"],
          "properties": {
            "projectionPolicy": { "type": "string", "minLength": 1 },
            "acceptedPaths": { "type": "array", "items": { "type": "string", "pattern": "^/" }, "uniqueItems": true },
            "unknownPolicy": { "type": "string", "minLength": 1 }
          }
        }
      }
    }
  },
  "$defs": {
    "claimStatus": { "enum": ["confirmed", "inferred", "unknown", "not_applicable"] },
    "confidence": { "enum": ["high", "medium", "low", "unknown"] },
    "sourceIdList": { "type": "array", "items": { "type": "string", "pattern": "^[a-z0-9][a-z0-9_-]*$" }, "uniqueItems": true },
    "evidenceSources": {
      "type": "object", "additionalProperties": false,
      "required": ["supportingSourceIds", "checkedSourceIds", "contradictingSourceIds"],
      "properties": {
        "supportingSourceIds": { "$ref": "#/$defs/sourceIdList" },
        "checkedSourceIds": { "$ref": "#/$defs/sourceIdList" },
        "contradictingSourceIds": { "$ref": "#/$defs/sourceIdList" }
      }
    },
    "textClaim": {
      "type": "object", "additionalProperties": false,
      "required": ["value", "status", "confidence", "evidenceSources", "note"],
      "properties": {
        "value": { "type": ["string", "null"] },
        "status": { "$ref": "#/$defs/claimStatus" },
        "confidence": { "$ref": "#/$defs/confidence" },
        "evidenceSources": { "$ref": "#/$defs/evidenceSources" },
        "note": { "type": "string" }
      }
    },
    "claim": {
      "type": "object", "additionalProperties": false,
      "required": ["value", "status", "confidence", "evidenceSources", "note"],
      "properties": {
        "value": {},
        "status": { "$ref": "#/$defs/claimStatus" },
        "confidence": { "$ref": "#/$defs/confidence" },
        "evidenceSources": { "$ref": "#/$defs/evidenceSources" },
        "note": { "type": "string" },
        "regionScope": { "type": "string" },
        "unit": { "type": "string" },
        "temperatureContext": { "enum": ["spawning", "catchability", "general", "unknown"] },
        "rangeType": { "enum": ["bounded_range", "maximum_only", "minimum_only", "point", "qualitative", "not_applicable", "unknown"] }
      }
    },
    "ecologyClaims": {
      "type": "object", "additionalProperties": false,
      "required": ["seasonality", "waterTemperature", "depthRange", "substrateHabitat", "salinityAndWaterBody", "dayNightTiming", "fishingMethods", "spawningOrConfusableInfo"],
      "properties": {
        "seasonality": { "$ref": "#/$defs/claim" },
        "waterTemperature": { "$ref": "#/$defs/claim" },
        "depthRange": { "$ref": "#/$defs/claim" },
        "substrateHabitat": { "$ref": "#/$defs/claim" },
        "salinityAndWaterBody": { "$ref": "#/$defs/claim" },
        "dayNightTiming": { "$ref": "#/$defs/claim" },
        "fishingMethods": { "$ref": "#/$defs/claim" },
        "spawningOrConfusableInfo": { "$ref": "#/$defs/claim" }
      }
    },
    "source": {
      "type": "object", "additionalProperties": false,
      "required": ["id", "title", "url", "publisher", "publisherType", "publishedOrUpdatedAt", "checkedAt", "regionScope", "sourceType", "directness", "derivationGroup", "supports", "usageNote"],
      "properties": {
        "id": { "type": "string", "pattern": "^[a-z0-9][a-z0-9_-]*$" },
        "title": { "type": "string", "minLength": 1 },
        "url": { "type": "string", "minLength": 1 },
        "publisher": { "type": "string", "minLength": 1 },
        "publisherType": { "enum": ["government", "public_research", "university", "museum_aquarium", "peer_reviewed", "secondary", "private_fishing", "unknown"] },
        "publishedOrUpdatedAt": { "type": ["string", "null"] },
        "checkedAt": { "type": "string", "format": "date" },
        "regionScope": { "type": "string", "minLength": 1 },
        "sourceType": { "enum": ["supporting", "checked", "contradicting"] },
        "directness": { "enum": ["direct", "indirect", "background"] },
        "derivationGroup": { "type": "string", "minLength": 1 },
        "supports": { "type": "array", "items": { "type": "string", "pattern": "^/" }, "uniqueItems": true },
        "usageNote": { "type": "string" }
      }
    },
    "decision": {
      "type": "object", "additionalProperties": false,
      "required": ["path", "decision", "reason", "purposes", "sourceIds", "regionScope", "confidence", "recheckCondition"],
      "properties": {
        "path": { "type": "string", "pattern": "^/" },
        "decision": { "enum": ["adopt", "adopt_with_warning", "hold", "reject"] },
        "reason": { "type": "string" },
        "purposes": { "type": "array", "minItems": 1, "items": { "enum": ["identity_display", "ecology_description", "spot_affinity", "environment_score", "method_affinity", "score_v2_water_temperature", "score_v2_season_time", "score_v2_spot_affinity", "score_v2_method_affinity", "score_excluded"] }, "uniqueItems": true },
        "sourceIds": { "$ref": "#/$defs/sourceIdList" },
        "regionScope": { "type": "string", "minLength": 1 },
        "confidence": { "$ref": "#/$defs/confidence" },
        "recheckCondition": { "type": "string", "minLength": 1 }
      }
    }
  }
}
