{"schemaVersion":"1.3.0","speciesId":"aomono","identity":{"displayNameJa":"青物","canonicalNameJa":{"value":null,"status":"unknown","confidence":"unknown","evidenceSources":{"supportingSourceIds":[],"checkedSourceIds":[],"contradictingSourceIds":[]},"note":"単一taxonとしてのcanonical和名を安全に確定していない。"},"scientificName":{"value":null,"status":"unknown","confidence":"unknown","evidenceSources":{"supportingSourceIds":[],"checkedSourceIds":[],"contradictingSourceIds":[]},"note":"採用可能な学名の直接根拠を確認していない。"},"aliases":[],"entityType":"species_group","note":"釣り上の便宜的グループで単一taxonではない。構成種の値を青物共通値へ集約しない。","parentGroupId":null,"memberSpeciesIds":["buri","hiramasa","kanpachi","sawara"]},"researchScope":{"targetArea":"福岡県糸島市西岸から唐津湾、伊万里湾、平戸方面の陸っぱり利用を想定。一般生態と対象地域の釣れやすさを分離し、本JSONは本番SCOREへ自動採用しない。","checkedAt":"2026-07-26","sourcePolicy":"docs/FISH_SPECIES_SECONDARY_SOURCE_POLICY.md"},"ecology":{"stableGeneral":{"seasonality":{"value":null,"status":"unknown","confidence":"unknown","evidenceSources":{"supportingSourceIds":[],"checkedSourceIds":[],"contradictingSourceIds":[]},"note":"直接根拠未確認。"},"waterTemperature":{"value":null,"status":"unknown","confidence":"unknown","evidenceSources":{"supportingSourceIds":[],"checkedSourceIds":[],"contradictingSourceIds":[]},"note":"直接根拠未確認。"},"depthRange":{"value":null,"status":"unknown","confidence":"unknown","evidenceSources":{"supportingSourceIds":[],"checkedSourceIds":[],"contradictingSourceIds":[]},"note":"直接根拠未確認。"},"substrateHabitat":{"value":null,"status":"unknown","confidence":"unknown","evidenceSources":{"supportingSourceIds":[],"checkedSourceIds":[],"contradictingSourceIds":[]},"note":"直接根拠未確認。"},"salinityAndWaterBody":{"value":null,"status":"unknown","confidence":"unknown","evidenceSources":{"supportingSourceIds":[],"checkedSourceIds":[],"contradictingSourceIds":[]},"note":"直接根拠未確認。"},"dayNightTiming":{"value":null,"status":"unknown","confidence":"unknown","evidenceSources":{"supportingSourceIds":[],"checkedSourceIds":[],"contradictingSourceIds":[]},"note":"直接根拠未確認。"},"fishingMethods":{"value":null,"status":"unknown","confidence":"unknown","evidenceSources":{"supportingSourceIds":[],"checkedSourceIds":[],"contradictingSourceIds":[]},"note":"直接根拠未確認。"},"spawningOrConfusableInfo":{"value":null,"status":"unknown","confidence":"unknown","evidenceSources":{"supportingSourceIds":[],"checkedSourceIds":[],"contradictingSourceIds":[]},"note":"直接根拠未確認。"}},"regionalCatchability":{"seasonality":{"value":null,"status":"unknown","confidence":"unknown","evidenceSources":{"supportingSourceIds":[],"checkedSourceIds":[],"contradictingSourceIds":[]},"note":"対象地域の直接根拠なし。"},"waterTemperature":{"value":null,"status":"unknown","confidence":"unknown","evidenceSources":{"supportingSourceIds":[],"checkedSourceIds":[],"contradictingSourceIds":[]},"note":"対象地域の直接根拠なし。"},"depthRange":{"value":null,"status":"unknown","confidence":"unknown","evidenceSources":{"supportingSourceIds":[],"checkedSourceIds":[],"contradictingSourceIds":[]},"note":"対象地域の直接根拠なし。"},"substrateHabitat":{"value":null,"status":"unknown","confidence":"unknown","evidenceSources":{"supportingSourceIds":[],"checkedSourceIds":[],"contradictingSourceIds":[]},"note":"対象地域の直接根拠なし。"},"salinityAndWaterBody":{"value":null,"status":"unknown","confidence":"unknown","evidenceSources":{"supportingSourceIds":[],"checkedSourceIds":[],"contradictingSourceIds":[]},"note":"対象地域の直接根拠なし。"},"dayNightTiming":{"value":null,"status":"unknown","confidence":"unknown","evidenceSources":{"supportingSourceIds":[],"checkedSourceIds":[],"contradictingSourceIds":[]},"note":"対象地域の直接根拠なし。"},"fishingMethods":{"value":null,"status":"unknown","confidence":"unknown","evidenceSources":{"supportingSourceIds":[],"checkedSourceIds":[],"contradictingSourceIds":[]},"note":"対象地域の直接根拠なし。"},"spawningOrConfusableInfo":{"value":null,"status":"unknown","confidence":"unknown","evidenceSources":{"supportingSourceIds":[],"checkedSourceIds":[],"contradictingSourceIds":[]},"note":"対象地域の直接根拠なし。"}}},"sources":[],"review":{"officialResearch":"公的・研究sourceを優先。","secondaryResearch":"二次sourceは一般生態の補助に限定。","schemaValidation":"v1.3.0自動検証対象。","comparisonWithCurrentImplementation":{"authoritativeComparisonDocument":"docs/research/FISH_SPECIES_ECOLOGY_A_REVIEW.md","scoreV2Status":"unsupported","inheritancePolicy":"do_not_inherit_between_species_or_group"},"attributeDecisions":[{"path":"/identity/canonicalNameJa","decision":"reject","reason":"表示グループのため単一taxonを設定しない。","purposes":["score_excluded"],"sourceIds":[],"regionScope":"未確定","confidence":"unknown","recheckCondition":"直接source取得時に再確認。"},{"path":"/identity/scientificName","decision":"reject","reason":"表示グループのため単一taxonを設定しない。","purposes":["score_excluded"],"sourceIds":[],"regionScope":"未確定","confidence":"unknown","recheckCondition":"直接source取得時に再確認。"},{"path":"/identity/aliases","decision":"reject","reason":"alias未評価。","purposes":["score_excluded"],"sourceIds":[],"regionScope":"未確定","confidence":"unknown","recheckCondition":"直接source取得時に再確認。"},{"path":"/ecology/stableGeneral/seasonality","decision":"hold","reason":"直接根拠なし。推測補完しない。","purposes":["score_excluded"],"sourceIds":[],"regionScope":"未確定","confidence":"unknown","recheckCondition":"直接source取得時に再確認。"},{"path":"/ecology/stableGeneral/waterTemperature","decision":"hold","reason":"直接根拠なし。推測補完しない。","purposes":["score_excluded"],"sourceIds":[],"regionScope":"未確定","confidence":"unknown","recheckCondition":"直接source取得時に再確認。"},{"path":"/ecology/stableGeneral/depthRange","decision":"hold","reason":"直接根拠なし。推測補完しない。","purposes":["score_excluded"],"sourceIds":[],"regionScope":"未確定","confidence":"unknown","recheckCondition":"直接source取得時に再確認。"},{"path":"/ecology/stableGeneral/substrateHabitat","decision":"hold","reason":"直接根拠なし。推測補完しない。","purposes":["score_excluded"],"sourceIds":[],"regionScope":"未確定","confidence":"unknown","recheckCondition":"直接source取得時に再確認。"},{"path":"/ecology/stableGeneral/salinityAndWaterBody","decision":"hold","reason":"直接根拠なし。推測補完しない。","purposes":["score_excluded"],"sourceIds":[],"regionScope":"未確定","confidence":"unknown","recheckCondition":"直接source取得時に再確認。"},{"path":"/ecology/stableGeneral/dayNightTiming","decision":"hold","reason":"直接根拠なし。推測補完しない。","purposes":["score_excluded"],"sourceIds":[],"regionScope":"未確定","confidence":"unknown","recheckCondition":"直接source取得時に再確認。"},{"path":"/ecology/stableGeneral/fishingMethods","decision":"hold","reason":"直接根拠なし。推測補完しない。","purposes":["score_excluded"],"sourceIds":[],"regionScope":"未確定","confidence":"unknown","recheckCondition":"直接source取得時に再確認。"},{"path":"/ecology/stableGeneral/spawningOrConfusableInfo","decision":"hold","reason":"直接根拠なし。推測補完しない。","purposes":["score_excluded"],"sourceIds":[],"regionScope":"未確定","confidence":"unknown","recheckCondition":"直接source取得時に再確認。"},{"path":"/ecology/regionalCatchability/seasonality","decision":"hold","reason":"対象地域の直接根拠なし。","purposes":["score_excluded"],"sourceIds":[],"regionScope":"未確定","confidence":"unknown","recheckCondition":"直接source取得時に再確認。"},{"path":"/ecology/regionalCatchability/waterTemperature","decision":"hold","reason":"対象地域の直接根拠なし。","purposes":["score_excluded"],"sourceIds":[],"regionScope":"未確定","confidence":"unknown","recheckCondition":"直接source取得時に再確認。"},{"path":"/ecology/regionalCatchability/depthRange","decision":"hold","reason":"対象地域の直接根拠なし。","purposes":["score_excluded"],"sourceIds":[],"regionScope":"未確定","confidence":"unknown","recheckCondition":"直接source取得時に再確認。"},{"path":"/ecology/regionalCatchability/substrateHabitat","decision":"hold","reason":"対象地域の直接根拠なし。","purposes":["score_excluded"],"sourceIds":[],"regionScope":"未確定","confidence":"unknown","recheckCondition":"直接source取得時に再確認。"},{"path":"/ecology/regionalCatchability/salinityAndWaterBody","decision":"hold","reason":"対象地域の直接根拠なし。","purposes":["score_excluded"],"sourceIds":[],"regionScope":"未確定","confidence":"unknown","recheckCondition":"直接source取得時に再確認。"},{"path":"/ecology/regionalCatchability/dayNightTiming","decision":"hold","reason":"対象地域の直接根拠なし。","purposes":["score_excluded"],"sourceIds":[],"regionScope":"未確定","confidence":"unknown","recheckCondition":"直接source取得時に再確認。"},{"path":"/ecology/regionalCatchability/fishingMethods","decision":"hold","reason":"対象地域の直接根拠なし。","purposes":["score_excluded"],"sourceIds":[],"regionScope":"未確定","confidence":"unknown","recheckCondition":"直接source取得時に再確認。"},{"path":"/ecology/regionalCatchability/spawningOrConfusableInfo","decision":"hold","reason":"対象地域の直接根拠なし。","purposes":["score_excluded"],"sourceIds":[],"regionScope":"未確定","confidence":"unknown","recheckCondition":"直接source取得時に再確認。"}],"reviewStatus":"ready_for_review","productionAdoption":{"projectionPolicy":"acceptedPathsのみ投影候補。SCORE未接続。","acceptedPaths":[],"unknownPolicy":"unknownを0点・不適へ変換しない。"}}}