{"schemaVersion":"1.3.0","speciesId":"eso","identity":{"displayNameJa":"エソ","canonicalNameJa":{"value":null,"status":"unknown","confidence":"unknown","evidenceSources":{"supportingSourceIds":[],"checkedSourceIds":[],"contradictingSourceIds":[]},"note":"species_groupの表示名を単一種のcanonical和名として確定しない。"},"scientificName":{"value":null,"status":"unknown","confidence":"unknown","evidenceSources":{"supportingSourceIds":[],"checkedSourceIds":[],"contradictingSourceIds":[]},"note":"species_groupに単一種の学名を設定しない。"},"aliases":[],"entityType":"species_group","note":"エソはアプリ上のspecies_groupで単一taxonではない。個別種のidentity・生態値・sourceを暗黙継承しない。","parentGroupId":null,"memberSpeciesIds":[]},"researchScope":{"targetArea":"福岡県糸島市西岸から唐津湾、伊万里湾、平戸方面の陸っぱり利用を想定。一般生態と対象地域の釣れやすさを分離し、本JSONは本番SCOREへ自動採用しない。","checkedAt":"2026-07-27","sourcePolicy":"docs/FISH_SPECIES_SECONDARY_SOURCE_POLICY.md"},"ecology":{"stableGeneral":{"seasonality":{"value":null,"status":"unknown","confidence":"unknown","evidenceSources":{"supportingSourceIds":[],"checkedSourceIds":[],"contradictingSourceIds":[]},"note":"直接根拠を確認できていない。推測で補完しない。"},"waterTemperature":{"value":null,"status":"unknown","confidence":"unknown","evidenceSources":{"supportingSourceIds":[],"checkedSourceIds":[],"contradictingSourceIds":[]},"note":"直接根拠を確認できていない。推測で補完しない。"},"depthRange":{"value":null,"status":"unknown","confidence":"unknown","evidenceSources":{"supportingSourceIds":[],"checkedSourceIds":[],"contradictingSourceIds":[]},"note":"直接根拠を確認できていない。推測で補完しない。"},"substrateHabitat":{"value":null,"status":"unknown","confidence":"unknown","evidenceSources":{"supportingSourceIds":[],"checkedSourceIds":[],"contradictingSourceIds":[]},"note":"直接根拠を確認できていない。推測で補完しない。"},"salinityAndWaterBody":{"value":null,"status":"unknown","confidence":"unknown","evidenceSources":{"supportingSourceIds":[],"checkedSourceIds":[],"contradictingSourceIds":[]},"note":"直接根拠を確認できていない。推測で補完しない。"},"dayNightTiming":{"value":null,"status":"unknown","confidence":"unknown","evidenceSources":{"supportingSourceIds":[],"checkedSourceIds":[],"contradictingSourceIds":[]},"note":"直接根拠を確認できていない。推測で補完しない。"},"fishingMethods":{"value":null,"status":"unknown","confidence":"unknown","evidenceSources":{"supportingSourceIds":[],"checkedSourceIds":[],"contradictingSourceIds":[]},"note":"直接根拠を確認できていない。推測で補完しない。"},"spawningOrConfusableInfo":{"value":null,"status":"unknown","confidence":"unknown","evidenceSources":{"supportingSourceIds":[],"checkedSourceIds":[],"contradictingSourceIds":[]},"note":"直接根拠を確認できていない。推測で補完しない。"}},"regionalCatchability":{"seasonality":{"value":null,"status":"unknown","confidence":"unknown","evidenceSources":{"supportingSourceIds":[],"checkedSourceIds":[],"contradictingSourceIds":[]},"note":"対象地域の陸っぱり釣れやすさを示す直接根拠を確認できていない。"},"waterTemperature":{"value":null,"status":"unknown","confidence":"unknown","evidenceSources":{"supportingSourceIds":[],"checkedSourceIds":[],"contradictingSourceIds":[]},"note":"対象地域の陸っぱり釣れやすさを示す直接根拠を確認できていない。"},"depthRange":{"value":null,"status":"unknown","confidence":"unknown","evidenceSources":{"supportingSourceIds":[],"checkedSourceIds":[],"contradictingSourceIds":[]},"note":"対象地域の陸っぱり釣れやすさを示す直接根拠を確認できていない。"},"substrateHabitat":{"value":null,"status":"unknown","confidence":"unknown","evidenceSources":{"supportingSourceIds":[],"checkedSourceIds":[],"contradictingSourceIds":[]},"note":"対象地域の陸っぱり釣れやすさを示す直接根拠を確認できていない。"},"salinityAndWaterBody":{"value":null,"status":"unknown","confidence":"unknown","evidenceSources":{"supportingSourceIds":[],"checkedSourceIds":[],"contradictingSourceIds":[]},"note":"対象地域の陸っぱり釣れやすさを示す直接根拠を確認できていない。"},"dayNightTiming":{"value":null,"status":"unknown","confidence":"unknown","evidenceSources":{"supportingSourceIds":[],"checkedSourceIds":[],"contradictingSourceIds":[]},"note":"対象地域の陸っぱり釣れやすさを示す直接根拠を確認できていない。"},"fishingMethods":{"value":null,"status":"unknown","confidence":"unknown","evidenceSources":{"supportingSourceIds":[],"checkedSourceIds":[],"contradictingSourceIds":[]},"note":"対象地域の陸っぱり釣れやすさを示す直接根拠を確認できていない。"},"spawningOrConfusableInfo":{"value":null,"status":"unknown","confidence":"unknown","evidenceSources":{"supportingSourceIds":[],"checkedSourceIds":[],"contradictingSourceIds":[]},"note":"対象地域の陸っぱり釣れやすさを示す直接根拠を確認できていない。"}}},"sources":[],"review":{"officialResearch":"単一taxonではないspecies_groupのため、個別種sourceを代表値として採用していない。","secondaryResearch":"個別種の二次sourceからグループ生態を補完していない。","schemaValidation":"fish-species-ecology.v1.3.0.schema.jsonと共通自動発見テストで検証する。","comparisonWithCurrentImplementation":{"authoritativeComparisonDocument":"docs/research/FISH_SPECIES_ECOLOGY_F_REVIEW.md","scoreV2Status":"unsupported","inheritancePolicy":"do_not_inherit_between_species_or_group"},"attributeDecisions":[{"path":"/identity/canonicalNameJa","decision":"reject","reason":"表示グループのため単一taxonを設定しない。","purposes":["score_excluded"],"sourceIds":[],"regionScope":"未確定","confidence":"unknown","recheckCondition":"masterが個別taxonへ分割された場合に再確認する。"},{"path":"/identity/scientificName","decision":"reject","reason":"表示グループのため単一taxonを設定しない。","purposes":["score_excluded"],"sourceIds":[],"regionScope":"未確定","confidence":"unknown","recheckCondition":"masterが個別taxonへ分割された場合に再確認する。"},{"path":"/identity/aliases","decision":"hold","reason":"本調査では別名の網羅性と同一性を再評価しない。","purposes":["score_excluded"],"sourceIds":[],"regionScope":"未確定","confidence":"unknown","recheckCondition":"alias masterを再調査するタスクで確認する。"},{"path":"/ecology/stableGeneral/seasonality","decision":"hold","reason":"species_groupへ個別種の生態を継承しない。","purposes":["score_excluded"],"sourceIds":[],"regionScope":"未確定","confidence":"unknown","recheckCondition":"masterが個別taxonへ分割された場合に再確認する。"},{"path":"/ecology/stableGeneral/waterTemperature","decision":"hold","reason":"species_groupへ個別種の生態を継承しない。","purposes":["score_excluded"],"sourceIds":[],"regionScope":"未確定","confidence":"unknown","recheckCondition":"masterが個別taxonへ分割された場合に再確認する。"},{"path":"/ecology/stableGeneral/depthRange","decision":"hold","reason":"species_groupへ個別種の生態を継承しない。","purposes":["score_excluded"],"sourceIds":[],"regionScope":"未確定","confidence":"unknown","recheckCondition":"masterが個別taxonへ分割された場合に再確認する。"},{"path":"/ecology/stableGeneral/substrateHabitat","decision":"hold","reason":"species_groupへ個別種の生態を継承しない。","purposes":["score_excluded"],"sourceIds":[],"regionScope":"未確定","confidence":"unknown","recheckCondition":"masterが個別taxonへ分割された場合に再確認する。"},{"path":"/ecology/stableGeneral/salinityAndWaterBody","decision":"hold","reason":"species_groupへ個別種の生態を継承しない。","purposes":["score_excluded"],"sourceIds":[],"regionScope":"未確定","confidence":"unknown","recheckCondition":"masterが個別taxonへ分割された場合に再確認する。"},{"path":"/ecology/stableGeneral/dayNightTiming","decision":"hold","reason":"species_groupへ個別種の生態を継承しない。","purposes":["score_excluded"],"sourceIds":[],"regionScope":"未確定","confidence":"unknown","recheckCondition":"masterが個別taxonへ分割された場合に再確認する。"},{"path":"/ecology/stableGeneral/fishingMethods","decision":"hold","reason":"species_groupへ個別種の生態を継承しない。","purposes":["score_excluded"],"sourceIds":[],"regionScope":"未確定","confidence":"unknown","recheckCondition":"masterが個別taxonへ分割された場合に再確認する。"},{"path":"/ecology/stableGeneral/spawningOrConfusableInfo","decision":"hold","reason":"species_groupへ個別種の生態を継承しない。","purposes":["score_excluded"],"sourceIds":[],"regionScope":"未確定","confidence":"unknown","recheckCondition":"masterが個別taxonへ分割された場合に再確認する。"},{"path":"/ecology/regionalCatchability/seasonality","decision":"hold","reason":"対象地域の陸っぱり釣れやすさを示す直接根拠が不足している。","purposes":["score_excluded"],"sourceIds":[],"regionScope":"未確定","confidence":"unknown","recheckCondition":"糸島〜唐津湾〜伊万里湾〜平戸の陸っぱり出現・釣果を属性と直接結び付ける信頼できる資料取得時に再確認する。"},{"path":"/ecology/regionalCatchability/waterTemperature","decision":"hold","reason":"対象地域の陸っぱり釣れやすさを示す直接根拠が不足している。","purposes":["score_excluded"],"sourceIds":[],"regionScope":"未確定","confidence":"unknown","recheckCondition":"糸島〜唐津湾〜伊万里湾〜平戸の陸っぱり出現・釣果を属性と直接結び付ける信頼できる資料取得時に再確認する。"},{"path":"/ecology/regionalCatchability/depthRange","decision":"hold","reason":"対象地域の陸っぱり釣れやすさを示す直接根拠が不足している。","purposes":["score_excluded"],"sourceIds":[],"regionScope":"未確定","confidence":"unknown","recheckCondition":"糸島〜唐津湾〜伊万里湾〜平戸の陸っぱり出現・釣果を属性と直接結び付ける信頼できる資料取得時に再確認する。"},{"path":"/ecology/regionalCatchability/substrateHabitat","decision":"hold","reason":"対象地域の陸っぱり釣れやすさを示す直接根拠が不足している。","purposes":["score_excluded"],"sourceIds":[],"regionScope":"未確定","confidence":"unknown","recheckCondition":"糸島〜唐津湾〜伊万里湾〜平戸の陸っぱり出現・釣果を属性と直接結び付ける信頼できる資料取得時に再確認する。"},{"path":"/ecology/regionalCatchability/salinityAndWaterBody","decision":"hold","reason":"対象地域の陸っぱり釣れやすさを示す直接根拠が不足している。","purposes":["score_excluded"],"sourceIds":[],"regionScope":"未確定","confidence":"unknown","recheckCondition":"糸島〜唐津湾〜伊万里湾〜平戸の陸っぱり出現・釣果を属性と直接結び付ける信頼できる資料取得時に再確認する。"},{"path":"/ecology/regionalCatchability/dayNightTiming","decision":"hold","reason":"対象地域の陸っぱり釣れやすさを示す直接根拠が不足している。","purposes":["score_excluded"],"sourceIds":[],"regionScope":"未確定","confidence":"unknown","recheckCondition":"糸島〜唐津湾〜伊万里湾〜平戸の陸っぱり出現・釣果を属性と直接結び付ける信頼できる資料取得時に再確認する。"},{"path":"/ecology/regionalCatchability/fishingMethods","decision":"hold","reason":"対象地域の陸っぱり釣れやすさを示す直接根拠が不足している。","purposes":["score_excluded"],"sourceIds":[],"regionScope":"未確定","confidence":"unknown","recheckCondition":"糸島〜唐津湾〜伊万里湾〜平戸の陸っぱり出現・釣果を属性と直接結び付ける信頼できる資料取得時に再確認する。"},{"path":"/ecology/regionalCatchability/spawningOrConfusableInfo","decision":"hold","reason":"対象地域の陸っぱり釣れやすさを示す直接根拠が不足している。","purposes":["score_excluded"],"sourceIds":[],"regionScope":"未確定","confidence":"unknown","recheckCondition":"糸島〜唐津湾〜伊万里湾〜平戸の陸っぱり出現・釣果を属性と直接結び付ける信頼できる資料取得時に再確認する。"}],"reviewStatus":"ready_for_review","productionAdoption":{"projectionPolicy":"acceptedPathsのみidentity表示または一般生態説明への投影候補とする。SCORE v2・地点相性・regionalCatchability・UI・DBへは未接続。","acceptedPaths":[],"unknownPolicy":"unknownを0点、不適、他魚種の値、一般漁期・産卵期・水揚げ時期で補完しない。"}}}