{"schemaVersion":"1.3.0","speciesId":"mebaru","identity":{"displayNameJa":"メバル","canonicalNameJa":{"value":null,"status":"unknown","confidence":"unknown","evidenceSources":{"supportingSourceIds":[],"checkedSourceIds":[],"contradictingSourceIds":[]},"note":""},"scientificName":{"value":null,"status":"unknown","confidence":"unknown","evidenceSources":{"supportingSourceIds":[],"checkedSourceIds":[],"contradictingSourceIds":[]},"note":""},"aliases":[],"entityType":"species_group","note":"表示グループ。構成種の生態を暗黙継承しない。","parentGroupId":"rockfish","memberSpeciesIds":["akamebaru","kuromebaru","shiromebaru"]},"researchScope":{"targetArea":"福岡県糸島市西岸〜唐津湾〜伊万里湾〜平戸方面。一般生態と地域釣れやすさを分離し、SCOREへ自動採用しない。","checkedAt":"2026-07-26","sourcePolicy":"docs/FISH_SPECIES_SECONDARY_SOURCE_POLICY.md"},"ecology":{"stableGeneral":{"seasonality":{"value":null,"status":"unknown","confidence":"unknown","evidenceSources":{"supportingSourceIds":[],"checkedSourceIds":[],"contradictingSourceIds":[]},"note":""},"waterTemperature":{"value":null,"status":"unknown","confidence":"unknown","evidenceSources":{"supportingSourceIds":[],"checkedSourceIds":[],"contradictingSourceIds":[]},"note":""},"depthRange":{"value":null,"status":"unknown","confidence":"unknown","evidenceSources":{"supportingSourceIds":[],"checkedSourceIds":[],"contradictingSourceIds":[]},"note":""},"substrateHabitat":{"value":null,"status":"unknown","confidence":"unknown","evidenceSources":{"supportingSourceIds":[],"checkedSourceIds":[],"contradictingSourceIds":[]},"note":""},"salinityAndWaterBody":{"value":null,"status":"unknown","confidence":"unknown","evidenceSources":{"supportingSourceIds":[],"checkedSourceIds":[],"contradictingSourceIds":[]},"note":""},"dayNightTiming":{"value":null,"status":"unknown","confidence":"unknown","evidenceSources":{"supportingSourceIds":[],"checkedSourceIds":[],"contradictingSourceIds":[]},"note":""},"fishingMethods":{"value":null,"status":"unknown","confidence":"unknown","evidenceSources":{"supportingSourceIds":[],"checkedSourceIds":[],"contradictingSourceIds":[]},"note":""},"spawningOrConfusableInfo":{"value":null,"status":"unknown","confidence":"unknown","evidenceSources":{"supportingSourceIds":[],"checkedSourceIds":[],"contradictingSourceIds":[]},"note":""}},"regionalCatchability":{"seasonality":{"value":null,"status":"unknown","confidence":"unknown","evidenceSources":{"supportingSourceIds":[],"checkedSourceIds":[],"contradictingSourceIds":[]},"note":""},"waterTemperature":{"value":null,"status":"unknown","confidence":"unknown","evidenceSources":{"supportingSourceIds":[],"checkedSourceIds":[],"contradictingSourceIds":[]},"note":""},"depthRange":{"value":null,"status":"unknown","confidence":"unknown","evidenceSources":{"supportingSourceIds":[],"checkedSourceIds":[],"contradictingSourceIds":[]},"note":""},"substrateHabitat":{"value":null,"status":"unknown","confidence":"unknown","evidenceSources":{"supportingSourceIds":[],"checkedSourceIds":[],"contradictingSourceIds":[]},"note":""},"salinityAndWaterBody":{"value":null,"status":"unknown","confidence":"unknown","evidenceSources":{"supportingSourceIds":[],"checkedSourceIds":[],"contradictingSourceIds":[]},"note":""},"dayNightTiming":{"value":null,"status":"unknown","confidence":"unknown","evidenceSources":{"supportingSourceIds":[],"checkedSourceIds":[],"contradictingSourceIds":[]},"note":""},"fishingMethods":{"value":null,"status":"unknown","confidence":"unknown","evidenceSources":{"supportingSourceIds":[],"checkedSourceIds":[],"contradictingSourceIds":[]},"note":""},"spawningOrConfusableInfo":{"value":null,"status":"unknown","confidence":"unknown","evidenceSources":{"supportingSourceIds":[],"checkedSourceIds":[],"contradictingSourceIds":[]},"note":""}}},"sources":[],"review":{"officialResearch":"公的・研究sourceを優先。","secondaryResearch":"二次sourceは一般生態の補助に限定。","schemaValidation":"v1.3.0自動検証対象。","comparisonWithCurrentImplementation":{"authoritativeComparisonDocument":"docs/research/FISH_SPECIES_ECOLOGY_C_REVIEW.md","scoreV2Status":"unsupported","inheritancePolicy":"do_not_inherit_between_species_or_group"},"attributeDecisions":[{"path":"/identity/canonicalNameJa","decision":"reject","reason":"表示グループのため単一taxonを設定しない。","purposes":["score_excluded"],"sourceIds":[],"regionScope":"未確定","confidence":"unknown","recheckCondition":"グループ定義変更時に再確認。"},{"path":"/identity/scientificName","decision":"reject","reason":"表示グループのため単一taxonを設定しない。","purposes":["score_excluded"],"sourceIds":[],"regionScope":"未確定","confidence":"unknown","recheckCondition":"グループ定義変更時に再確認。"},{"path":"/identity/aliases","decision":"reject","reason":"alias未評価。","purposes":["score_excluded"],"sourceIds":[],"regionScope":"未確定","confidence":"unknown","recheckCondition":"aliasを直接支えるsource取得時に再確認。"},{"path":"/ecology/stableGeneral/seasonality","decision":"hold","reason":"直接根拠なし。推測補完しない。","purposes":["score_excluded"],"sourceIds":[],"regionScope":"未確定","confidence":"unknown","recheckCondition":"直接source取得時に再確認。"},{"path":"/ecology/stableGeneral/waterTemperature","decision":"hold","reason":"直接根拠なし。推測補完しない。","purposes":["score_excluded"],"sourceIds":[],"regionScope":"未確定","confidence":"unknown","recheckCondition":"直接source取得時に再確認。"},{"path":"/ecology/stableGeneral/depthRange","decision":"hold","reason":"直接根拠なし。推測補完しない。","purposes":["score_excluded"],"sourceIds":[],"regionScope":"未確定","confidence":"unknown","recheckCondition":"直接source取得時に再確認。"},{"path":"/ecology/stableGeneral/substrateHabitat","decision":"hold","reason":"直接根拠なし。推測補完しない。","purposes":["score_excluded"],"sourceIds":[],"regionScope":"未確定","confidence":"unknown","recheckCondition":"直接source取得時に再確認。"},{"path":"/ecology/stableGeneral/salinityAndWaterBody","decision":"hold","reason":"直接根拠なし。推測補完しない。","purposes":["score_excluded"],"sourceIds":[],"regionScope":"未確定","confidence":"unknown","recheckCondition":"直接source取得時に再確認。"},{"path":"/ecology/stableGeneral/dayNightTiming","decision":"hold","reason":"直接根拠なし。推測補完しない。","purposes":["score_excluded"],"sourceIds":[],"regionScope":"未確定","confidence":"unknown","recheckCondition":"直接source取得時に再確認。"},{"path":"/ecology/stableGeneral/fishingMethods","decision":"hold","reason":"直接根拠なし。推測補完しない。","purposes":["score_excluded"],"sourceIds":[],"regionScope":"未確定","confidence":"unknown","recheckCondition":"直接source取得時に再確認。"},{"path":"/ecology/stableGeneral/spawningOrConfusableInfo","decision":"hold","reason":"直接根拠なし。推測補完しない。","purposes":["score_excluded"],"sourceIds":[],"regionScope":"未確定","confidence":"unknown","recheckCondition":"直接source取得時に再確認。"},{"path":"/ecology/regionalCatchability/seasonality","decision":"hold","reason":"直接根拠なし。推測補完しない。","purposes":["score_excluded"],"sourceIds":[],"regionScope":"未確定","confidence":"unknown","recheckCondition":"直接source取得時に再確認。"},{"path":"/ecology/regionalCatchability/waterTemperature","decision":"hold","reason":"直接根拠なし。推測補完しない。","purposes":["score_excluded"],"sourceIds":[],"regionScope":"未確定","confidence":"unknown","recheckCondition":"直接source取得時に再確認。"},{"path":"/ecology/regionalCatchability/depthRange","decision":"hold","reason":"直接根拠なし。推測補完しない。","purposes":["score_excluded"],"sourceIds":[],"regionScope":"未確定","confidence":"unknown","recheckCondition":"直接source取得時に再確認。"},{"path":"/ecology/regionalCatchability/substrateHabitat","decision":"hold","reason":"直接根拠なし。推測補完しない。","purposes":["score_excluded"],"sourceIds":[],"regionScope":"未確定","confidence":"unknown","recheckCondition":"直接source取得時に再確認。"},{"path":"/ecology/regionalCatchability/salinityAndWaterBody","decision":"hold","reason":"直接根拠なし。推測補完しない。","purposes":["score_excluded"],"sourceIds":[],"regionScope":"未確定","confidence":"unknown","recheckCondition":"直接source取得時に再確認。"},{"path":"/ecology/regionalCatchability/dayNightTiming","decision":"hold","reason":"直接根拠なし。推測補完しない。","purposes":["score_excluded"],"sourceIds":[],"regionScope":"未確定","confidence":"unknown","recheckCondition":"直接source取得時に再確認。"},{"path":"/ecology/regionalCatchability/fishingMethods","decision":"hold","reason":"直接根拠なし。推測補完しない。","purposes":["score_excluded"],"sourceIds":[],"regionScope":"未確定","confidence":"unknown","recheckCondition":"直接source取得時に再確認。"},{"path":"/ecology/regionalCatchability/spawningOrConfusableInfo","decision":"hold","reason":"直接根拠なし。推測補完しない。","purposes":["score_excluded"],"sourceIds":[],"regionScope":"未確定","confidence":"unknown","recheckCondition":"直接source取得時に再確認。"}],"reviewStatus":"ready_for_review","productionAdoption":{"projectionPolicy":"acceptedPathsのみ投影候補。SCORE未接続。","acceptedPaths":[],"unknownPolicy":"unknownを0点・不適へ変換しない。"}}}