{"schemaVersion":"1.3.0","speciesId":"akamebaru","identity":{"displayNameJa":"アカメバル","canonicalNameJa":{"value":"アカメバル","status":"confirmed","confidence":"high","evidenceSources":{"supportingSourceIds":["bismal_akamebaru"],"checkedSourceIds":[],"contradictingSourceIds":[]},"note":""},"scientificName":{"value":"Sebastes inermis","status":"confirmed","confidence":"high","evidenceSources":{"supportingSourceIds":["bismal_akamebaru"],"checkedSourceIds":[],"contradictingSourceIds":[]},"note":""},"aliases":[],"entityType":"exact_species","note":"個別種の値を親・兄弟種へ継承しない。","parentGroupId":"mebaru","memberSpeciesIds":[]},"researchScope":{"targetArea":"福岡県糸島市西岸〜唐津湾〜伊万里湾〜平戸方面。一般生態と地域釣れやすさを分離し、SCOREへ自動採用しない。","checkedAt":"2026-07-26","sourcePolicy":"docs/FISH_SPECIES_SECONDARY_SOURCE_POLICY.md"},"ecology":{"stableGeneral":{"seasonality":{"value":null,"status":"unknown","confidence":"unknown","evidenceSources":{"supportingSourceIds":[],"checkedSourceIds":[],"contradictingSourceIds":[]},"note":""},"waterTemperature":{"value":null,"status":"unknown","confidence":"unknown","evidenceSources":{"supportingSourceIds":[],"checkedSourceIds":[],"contradictingSourceIds":[]},"note":""},"depthRange":{"value":null,"status":"unknown","confidence":"unknown","evidenceSources":{"supportingSourceIds":[],"checkedSourceIds":[],"contradictingSourceIds":[]},"note":""},"substrateHabitat":{"value":null,"status":"unknown","confidence":"unknown","evidenceSources":{"supportingSourceIds":[],"checkedSourceIds":[],"contradictingSourceIds":[]},"note":""},"salinityAndWaterBody":{"value":["海水","底生","回遊性あり"],"status":"confirmed","confidence":"medium","evidenceSources":{"supportingSourceIds":["fishbase_akamebaru"],"checkedSourceIds":[],"contradictingSourceIds":[]},"note":"一般生態の説明用途に限定。","regionScope":"北西太平洋","rangeType":"qualitative"},"dayNightTiming":{"value":null,"status":"unknown","confidence":"unknown","evidenceSources":{"supportingSourceIds":[],"checkedSourceIds":[],"contradictingSourceIds":[]},"note":""},"fishingMethods":{"value":null,"status":"unknown","confidence":"unknown","evidenceSources":{"supportingSourceIds":[],"checkedSourceIds":[],"contradictingSourceIds":[]},"note":""},"spawningOrConfusableInfo":{"value":["アカメバル・クロメバル・シロメバルはSebastes inermis種群として分類レビュー対象"],"status":"confirmed","confidence":"medium","evidenceSources":{"supportingSourceIds":["bismal_akamebaru"],"checkedSourceIds":[],"contradictingSourceIds":[]},"note":"産卵・分類情報。釣期や他種へ転用しない。","regionScope":"分類情報","rangeType":"qualitative"}},"regionalCatchability":{"seasonality":{"value":null,"status":"unknown","confidence":"unknown","evidenceSources":{"supportingSourceIds":[],"checkedSourceIds":[],"contradictingSourceIds":[]},"note":""},"waterTemperature":{"value":null,"status":"unknown","confidence":"unknown","evidenceSources":{"supportingSourceIds":[],"checkedSourceIds":[],"contradictingSourceIds":[]},"note":""},"depthRange":{"value":null,"status":"unknown","confidence":"unknown","evidenceSources":{"supportingSourceIds":[],"checkedSourceIds":[],"contradictingSourceIds":[]},"note":""},"substrateHabitat":{"value":null,"status":"unknown","confidence":"unknown","evidenceSources":{"supportingSourceIds":[],"checkedSourceIds":[],"contradictingSourceIds":[]},"note":""},"salinityAndWaterBody":{"value":null,"status":"unknown","confidence":"unknown","evidenceSources":{"supportingSourceIds":[],"checkedSourceIds":[],"contradictingSourceIds":[]},"note":""},"dayNightTiming":{"value":null,"status":"unknown","confidence":"unknown","evidenceSources":{"supportingSourceIds":[],"checkedSourceIds":[],"contradictingSourceIds":[]},"note":""},"fishingMethods":{"value":null,"status":"unknown","confidence":"unknown","evidenceSources":{"supportingSourceIds":[],"checkedSourceIds":[],"contradictingSourceIds":[]},"note":""},"spawningOrConfusableInfo":{"value":null,"status":"unknown","confidence":"unknown","evidenceSources":{"supportingSourceIds":[],"checkedSourceIds":[],"contradictingSourceIds":[]},"note":""}}},"sources":[{"id":"bismal_akamebaru","title":"Sebastes inermis アカメバル","url":"https://www.godac.jamstec.go.jp/bismal/j/view/9001584","publisher":"JAMSTEC BISMaL","publisherType":"public_research","publishedOrUpdatedAt":null,"checkedAt":"2026-07-26","regionScope":"分類情報・メバル種群","sourceType":"supporting","directness":"direct","derivationGroup":"bismal_akamebaru","supports":["/identity/canonicalNameJa","/identity/scientificName","/ecology/stableGeneral/spawningOrConfusableInfo"],"usageNote":""},{"id":"fishbase_akamebaru","title":"Sebastes inermis summary page","url":"https://fishbase.org/summary/SpeciesSummary.php?id=4586&lang=English","publisher":"FishBase","publisherType":"secondary","publishedOrUpdatedAt":null,"checkedAt":"2026-07-26","regionScope":"北西太平洋の一般生態","sourceType":"supporting","directness":"direct","derivationGroup":"fishbase_akamebaru","supports":["/ecology/stableGeneral/salinityAndWaterBody"],"usageNote":""}],"review":{"officialResearch":"公的・研究sourceを優先。","secondaryResearch":"二次sourceは一般生態の補助に限定。","schemaValidation":"v1.3.0自動検証対象。","comparisonWithCurrentImplementation":{"authoritativeComparisonDocument":"docs/research/FISH_SPECIES_ECOLOGY_C_REVIEW.md","scoreV2Status":"unsupported","inheritancePolicy":"do_not_inherit_between_species_or_group"},"attributeDecisions":[{"path":"/identity/canonicalNameJa","decision":"adopt","reason":"根拠の範囲内で採用。SCOREへ自動投影しない。","purposes":["identity_display"],"sourceIds":["bismal_akamebaru"],"regionScope":"分類情報","confidence":"high","recheckCondition":"source改訂またはSCORE利用時に再確認。"},{"path":"/identity/scientificName","decision":"adopt","reason":"根拠の範囲内で採用。SCOREへ自動投影しない。","purposes":["identity_display"],"sourceIds":["bismal_akamebaru"],"regionScope":"分類情報","confidence":"high","recheckCondition":"source改訂またはSCORE利用時に再確認。"},{"path":"/identity/aliases","decision":"reject","reason":"alias未評価。","purposes":["score_excluded"],"sourceIds":[],"regionScope":"未確定","confidence":"unknown","recheckCondition":"aliasを直接支えるsource取得時に再確認。"},{"path":"/ecology/stableGeneral/seasonality","decision":"hold","reason":"直接根拠なし。推測補完しない。","purposes":["score_excluded"],"sourceIds":[],"regionScope":"未確定","confidence":"unknown","recheckCondition":"直接source取得時に再確認。"},{"path":"/ecology/stableGeneral/waterTemperature","decision":"hold","reason":"直接根拠なし。推測補完しない。","purposes":["score_excluded"],"sourceIds":[],"regionScope":"未確定","confidence":"unknown","recheckCondition":"直接source取得時に再確認。"},{"path":"/ecology/stableGeneral/depthRange","decision":"hold","reason":"直接根拠なし。推測補完しない。","purposes":["score_excluded"],"sourceIds":[],"regionScope":"未確定","confidence":"unknown","recheckCondition":"直接source取得時に再確認。"},{"path":"/ecology/stableGeneral/substrateHabitat","decision":"hold","reason":"直接根拠なし。推測補完しない。","purposes":["score_excluded"],"sourceIds":[],"regionScope":"未確定","confidence":"unknown","recheckCondition":"直接source取得時に再確認。"},{"path":"/ecology/stableGeneral/salinityAndWaterBody","decision":"adopt_with_warning","reason":"根拠の範囲内で採用。SCOREへ自動投影しない。","purposes":["ecology_description"],"sourceIds":["fishbase_akamebaru"],"regionScope":"北西太平洋","confidence":"medium","recheckCondition":"source改訂またはSCORE利用時に再確認。"},{"path":"/ecology/stableGeneral/dayNightTiming","decision":"hold","reason":"直接根拠なし。推測補完しない。","purposes":["score_excluded"],"sourceIds":[],"regionScope":"未確定","confidence":"unknown","recheckCondition":"直接source取得時に再確認。"},{"path":"/ecology/stableGeneral/fishingMethods","decision":"hold","reason":"直接根拠なし。推測補完しない。","purposes":["score_excluded"],"sourceIds":[],"regionScope":"未確定","confidence":"unknown","recheckCondition":"直接source取得時に再確認。"},{"path":"/ecology/stableGeneral/spawningOrConfusableInfo","decision":"adopt_with_warning","reason":"根拠の範囲内で採用。SCOREへ自動投影しない。","purposes":["ecology_description"],"sourceIds":["bismal_akamebaru"],"regionScope":"分類情報","confidence":"medium","recheckCondition":"source改訂またはSCORE利用時に再確認。"},{"path":"/ecology/regionalCatchability/seasonality","decision":"hold","reason":"直接根拠なし。推測補完しない。","purposes":["score_excluded"],"sourceIds":[],"regionScope":"未確定","confidence":"unknown","recheckCondition":"直接source取得時に再確認。"},{"path":"/ecology/regionalCatchability/waterTemperature","decision":"hold","reason":"直接根拠なし。推測補完しない。","purposes":["score_excluded"],"sourceIds":[],"regionScope":"未確定","confidence":"unknown","recheckCondition":"直接source取得時に再確認。"},{"path":"/ecology/regionalCatchability/depthRange","decision":"hold","reason":"直接根拠なし。推測補完しない。","purposes":["score_excluded"],"sourceIds":[],"regionScope":"未確定","confidence":"unknown","recheckCondition":"直接source取得時に再確認。"},{"path":"/ecology/regionalCatchability/substrateHabitat","decision":"hold","reason":"直接根拠なし。推測補完しない。","purposes":["score_excluded"],"sourceIds":[],"regionScope":"未確定","confidence":"unknown","recheckCondition":"直接source取得時に再確認。"},{"path":"/ecology/regionalCatchability/salinityAndWaterBody","decision":"hold","reason":"直接根拠なし。推測補完しない。","purposes":["score_excluded"],"sourceIds":[],"regionScope":"未確定","confidence":"unknown","recheckCondition":"直接source取得時に再確認。"},{"path":"/ecology/regionalCatchability/dayNightTiming","decision":"hold","reason":"直接根拠なし。推測補完しない。","purposes":["score_excluded"],"sourceIds":[],"regionScope":"未確定","confidence":"unknown","recheckCondition":"直接source取得時に再確認。"},{"path":"/ecology/regionalCatchability/fishingMethods","decision":"hold","reason":"直接根拠なし。推測補完しない。","purposes":["score_excluded"],"sourceIds":[],"regionScope":"未確定","confidence":"unknown","recheckCondition":"直接source取得時に再確認。"},{"path":"/ecology/regionalCatchability/spawningOrConfusableInfo","decision":"hold","reason":"直接根拠なし。推測補完しない。","purposes":["score_excluded"],"sourceIds":[],"regionScope":"未確定","confidence":"unknown","recheckCondition":"直接source取得時に再確認。"}],"reviewStatus":"ready_for_review","productionAdoption":{"projectionPolicy":"acceptedPathsのみ投影候補。SCORE未接続。","acceptedPaths":["/identity/canonicalNameJa","/identity/scientificName","/ecology/stableGeneral/salinityAndWaterBody","/ecology/stableGeneral/spawningOrConfusableInfo"],"unknownPolicy":"unknownを0点・不適へ変換しない。"}}}