{"schemaVersion":"1.3.0","speciesId":"katakuchiiwashi","identity":{"displayNameJa":"カタクチイワシ","canonicalNameJa":{"value":"カタクチイワシ","status":"confirmed","confidence":"high","evidenceSources":{"supportingSourceIds":["mie_katakuchiiwashi"],"checkedSourceIds":[],"contradictingSourceIds":[]},"note":""},"scientificName":{"value":"Engraulis japonicus","status":"confirmed","confidence":"medium","evidenceSources":{"supportingSourceIds":["mie_katakuchiiwashi"],"checkedSourceIds":[],"contradictingSourceIds":[]},"note":"三重県水産研究所の表記を採用。分類DBとの表記差は将来再確認。"},"aliases":[],"entityType":"exact_species","note":"カタクチイワシ固有値として管理する。","parentGroupId":"iwashi","memberSpeciesIds":[]},"researchScope":{"targetArea":"福岡県糸島市西岸から唐津湾、伊万里湾、平戸方面の陸っぱり利用を想定。一般生態と対象地域の釣れやすさを分離し、本JSONは本番SCOREへ自動採用しない。","checkedAt":"2026-07-26","sourcePolicy":"docs/FISH_SPECIES_SECONDARY_SOURCE_POLICY.md"},"ecology":{"stableGeneral":{"seasonality":{"value":null,"status":"unknown","confidence":"unknown","evidenceSources":{"supportingSourceIds":[],"checkedSourceIds":[],"contradictingSourceIds":[]},"note":"直接根拠未確認。"},"waterTemperature":{"value":null,"status":"unknown","confidence":"unknown","evidenceSources":{"supportingSourceIds":[],"checkedSourceIds":[],"contradictingSourceIds":[]},"note":"直接根拠未確認。"},"depthRange":{"value":null,"status":"unknown","confidence":"unknown","evidenceSources":{"supportingSourceIds":[],"checkedSourceIds":[],"contradictingSourceIds":[]},"note":"直接根拠未確認。"},"substrateHabitat":{"value":null,"status":"unknown","confidence":"unknown","evidenceSources":{"supportingSourceIds":[],"checkedSourceIds":[],"contradictingSourceIds":[]},"note":"直接根拠未確認。"},"salinityAndWaterBody":{"value":["内湾","沿岸域"],"status":"confirmed","confidence":"medium","evidenceSources":{"supportingSourceIds":["mie_katakuchiiwashi"],"checkedSourceIds":[],"contradictingSourceIds":[]},"note":"内湾から沿岸に生息するとの公的解説。対象地域の釣れやすさは別扱い。","regionScope":"一般生態","rangeType":"qualitative"},"dayNightTiming":{"value":null,"status":"unknown","confidence":"unknown","evidenceSources":{"supportingSourceIds":[],"checkedSourceIds":[],"contradictingSourceIds":[]},"note":"直接根拠未確認。"},"fishingMethods":{"value":null,"status":"unknown","confidence":"unknown","evidenceSources":{"supportingSourceIds":[],"checkedSourceIds":[],"contradictingSourceIds":[]},"note":"直接根拠未確認。"},"spawningOrConfusableInfo":{"value":{"spawningTiming":"ほぼ周年"},"status":"confirmed","confidence":"medium","evidenceSources":{"supportingSourceIds":["mie_katakuchiiwashi"],"checkedSourceIds":[],"contradictingSourceIds":[]},"note":"産卵時期の一般説明であり釣期ではない。","regionScope":"三重県水産研究所の一般解説","rangeType":"qualitative"}},"regionalCatchability":{"seasonality":{"value":null,"status":"unknown","confidence":"unknown","evidenceSources":{"supportingSourceIds":[],"checkedSourceIds":[],"contradictingSourceIds":[]},"note":"対象地域の直接根拠なし。"},"waterTemperature":{"value":null,"status":"unknown","confidence":"unknown","evidenceSources":{"supportingSourceIds":[],"checkedSourceIds":[],"contradictingSourceIds":[]},"note":"対象地域の直接根拠なし。"},"depthRange":{"value":null,"status":"unknown","confidence":"unknown","evidenceSources":{"supportingSourceIds":[],"checkedSourceIds":[],"contradictingSourceIds":[]},"note":"対象地域の直接根拠なし。"},"substrateHabitat":{"value":null,"status":"unknown","confidence":"unknown","evidenceSources":{"supportingSourceIds":[],"checkedSourceIds":[],"contradictingSourceIds":[]},"note":"対象地域の直接根拠なし。"},"salinityAndWaterBody":{"value":null,"status":"unknown","confidence":"unknown","evidenceSources":{"supportingSourceIds":[],"checkedSourceIds":[],"contradictingSourceIds":[]},"note":"対象地域の直接根拠なし。"},"dayNightTiming":{"value":null,"status":"unknown","confidence":"unknown","evidenceSources":{"supportingSourceIds":[],"checkedSourceIds":[],"contradictingSourceIds":[]},"note":"対象地域の直接根拠なし。"},"fishingMethods":{"value":null,"status":"unknown","confidence":"unknown","evidenceSources":{"supportingSourceIds":[],"checkedSourceIds":[],"contradictingSourceIds":[]},"note":"対象地域の直接根拠なし。"},"spawningOrConfusableInfo":{"value":null,"status":"unknown","confidence":"unknown","evidenceSources":{"supportingSourceIds":[],"checkedSourceIds":[],"contradictingSourceIds":[]},"note":"対象地域の直接根拠なし。"}}},"sources":[{"id":"mie_katakuchiiwashi","title":"おさかな図鑑・情報：カタクチイワシ","url":"https://www.mpstpc.pref.mie.lg.jp/SUI/zukan/asp/detail.asp?record=1437","publisher":"三重県水産研究所","publisherType":"government","publishedOrUpdatedAt":null,"checkedAt":"2026-07-26","regionScope":"三重県・一般生態","sourceType":"supporting","directness":"direct","derivationGroup":"mie_katakuchiiwashi","supports":["/identity/canonicalNameJa","/identity/scientificName","/ecology/stableGeneral/salinityAndWaterBody","/ecology/stableGeneral/spawningOrConfusableInfo"],"usageNote":"分類・生態情報のみ利用。"}],"review":{"officialResearch":"公的・研究sourceを優先。","secondaryResearch":"二次sourceは一般生態の補助に限定。","schemaValidation":"v1.3.0自動検証対象。","comparisonWithCurrentImplementation":{"authoritativeComparisonDocument":"docs/research/FISH_SPECIES_ECOLOGY_A_REVIEW.md","scoreV2Status":"unsupported","inheritancePolicy":"do_not_inherit_between_species_or_group"},"attributeDecisions":[{"path":"/identity/canonicalNameJa","decision":"adopt","reason":"分類の直接根拠あり。","purposes":["identity_display"],"sourceIds":["mie_katakuchiiwashi"],"regionScope":"分類情報","confidence":"high","recheckCondition":"分類変更またはSCORE利用前に再確認。"},{"path":"/identity/scientificName","decision":"adopt_with_warning","reason":"分類の直接根拠あり。","purposes":["identity_display"],"sourceIds":["mie_katakuchiiwashi"],"regionScope":"分類情報","confidence":"medium","recheckCondition":"分類変更またはSCORE利用前に再確認。"},{"path":"/identity/aliases","decision":"reject","reason":"alias未評価。","purposes":["score_excluded"],"sourceIds":[],"regionScope":"未確定","confidence":"unknown","recheckCondition":"直接source取得時に再確認。"},{"path":"/ecology/stableGeneral/seasonality","decision":"hold","reason":"直接根拠なし。推測補完しない。","purposes":["score_excluded"],"sourceIds":[],"regionScope":"未確定","confidence":"unknown","recheckCondition":"直接source取得時に再確認。"},{"path":"/ecology/stableGeneral/waterTemperature","decision":"hold","reason":"直接根拠なし。推測補完しない。","purposes":["score_excluded"],"sourceIds":[],"regionScope":"未確定","confidence":"unknown","recheckCondition":"直接source取得時に再確認。"},{"path":"/ecology/stableGeneral/depthRange","decision":"hold","reason":"直接根拠なし。推測補完しない。","purposes":["score_excluded"],"sourceIds":[],"regionScope":"未確定","confidence":"unknown","recheckCondition":"直接source取得時に再確認。"},{"path":"/ecology/stableGeneral/substrateHabitat","decision":"hold","reason":"直接根拠なし。推測補完しない。","purposes":["score_excluded"],"sourceIds":[],"regionScope":"未確定","confidence":"unknown","recheckCondition":"直接source取得時に再確認。"},{"path":"/ecology/stableGeneral/salinityAndWaterBody","decision":"adopt_with_warning","reason":"一般化せず生態説明に限定。","purposes":["ecology_description"],"sourceIds":["mie_katakuchiiwashi"],"regionScope":"一般生態","confidence":"medium","recheckCondition":"分類変更またはSCORE利用前に再確認。"},{"path":"/ecology/stableGeneral/dayNightTiming","decision":"hold","reason":"直接根拠なし。推測補完しない。","purposes":["score_excluded"],"sourceIds":[],"regionScope":"未確定","confidence":"unknown","recheckCondition":"直接source取得時に再確認。"},{"path":"/ecology/stableGeneral/fishingMethods","decision":"hold","reason":"直接根拠なし。推測補完しない。","purposes":["score_excluded"],"sourceIds":[],"regionScope":"未確定","confidence":"unknown","recheckCondition":"直接source取得時に再確認。"},{"path":"/ecology/stableGeneral/spawningOrConfusableInfo","decision":"adopt_with_warning","reason":"一般化せず生態説明に限定。","purposes":["ecology_description"],"sourceIds":["mie_katakuchiiwashi"],"regionScope":"三重県水産研究所の一般解説","confidence":"medium","recheckCondition":"分類変更またはSCORE利用前に再確認。"},{"path":"/ecology/regionalCatchability/seasonality","decision":"hold","reason":"対象地域の直接根拠なし。","purposes":["score_excluded"],"sourceIds":[],"regionScope":"未確定","confidence":"unknown","recheckCondition":"直接source取得時に再確認。"},{"path":"/ecology/regionalCatchability/waterTemperature","decision":"hold","reason":"対象地域の直接根拠なし。","purposes":["score_excluded"],"sourceIds":[],"regionScope":"未確定","confidence":"unknown","recheckCondition":"直接source取得時に再確認。"},{"path":"/ecology/regionalCatchability/depthRange","decision":"hold","reason":"対象地域の直接根拠なし。","purposes":["score_excluded"],"sourceIds":[],"regionScope":"未確定","confidence":"unknown","recheckCondition":"直接source取得時に再確認。"},{"path":"/ecology/regionalCatchability/substrateHabitat","decision":"hold","reason":"対象地域の直接根拠なし。","purposes":["score_excluded"],"sourceIds":[],"regionScope":"未確定","confidence":"unknown","recheckCondition":"直接source取得時に再確認。"},{"path":"/ecology/regionalCatchability/salinityAndWaterBody","decision":"hold","reason":"対象地域の直接根拠なし。","purposes":["score_excluded"],"sourceIds":[],"regionScope":"未確定","confidence":"unknown","recheckCondition":"直接source取得時に再確認。"},{"path":"/ecology/regionalCatchability/dayNightTiming","decision":"hold","reason":"対象地域の直接根拠なし。","purposes":["score_excluded"],"sourceIds":[],"regionScope":"未確定","confidence":"unknown","recheckCondition":"直接source取得時に再確認。"},{"path":"/ecology/regionalCatchability/fishingMethods","decision":"hold","reason":"対象地域の直接根拠なし。","purposes":["score_excluded"],"sourceIds":[],"regionScope":"未確定","confidence":"unknown","recheckCondition":"直接source取得時に再確認。"},{"path":"/ecology/regionalCatchability/spawningOrConfusableInfo","decision":"hold","reason":"対象地域の直接根拠なし。","purposes":["score_excluded"],"sourceIds":[],"regionScope":"未確定","confidence":"unknown","recheckCondition":"直接source取得時に再確認。"}],"reviewStatus":"ready_for_review","productionAdoption":{"projectionPolicy":"acceptedPathsのみ投影候補。SCORE未接続。","acceptedPaths":["/identity/canonicalNameJa","/identity/scientificName","/ecology/stableGeneral/salinityAndWaterBody","/ecology/stableGeneral/spawningOrConfusableInfo"],"unknownPolicy":"unknownを0点・不適へ変換しない。"}}}