{"schemaVersion":"1.3.0","speciesId":"aohata","identity":{"displayNameJa":"アオハタ","canonicalNameJa":{"value":"アオハタ","status":"confirmed","confidence":"high","evidenceSources":{"supportingSourceIds":["bismal_aohata"],"checkedSourceIds":[],"contradictingSourceIds":[]},"note":""},"scientificName":{"value":"Epinephelus awoara","status":"confirmed","confidence":"high","evidenceSources":{"supportingSourceIds":["bismal_aohata"],"checkedSourceIds":[],"contradictingSourceIds":[]},"note":""},"aliases":[],"entityType":"exact_species","note":"個別種の値を親・兄弟種へ継承しない。","parentGroupId":"rockfish","memberSpeciesIds":[]},"researchScope":{"targetArea":"福岡県糸島市西岸〜唐津湾〜伊万里湾〜平戸方面。一般生態と地域釣れやすさを分離し、SCOREへ自動採用しない。","checkedAt":"2026-07-26","sourcePolicy":"docs/FISH_SPECIES_SECONDARY_SOURCE_POLICY.md"},"ecology":{"stableGeneral":{"seasonality":{"value":null,"status":"unknown","confidence":"unknown","evidenceSources":{"supportingSourceIds":[],"checkedSourceIds":[],"contradictingSourceIds":[]},"note":""},"waterTemperature":{"value":null,"status":"unknown","confidence":"unknown","evidenceSources":{"supportingSourceIds":[],"checkedSourceIds":[],"contradictingSourceIds":[]},"note":""},"depthRange":{"value":{"min":10,"max":50},"status":"confirmed","confidence":"medium","evidenceSources":{"supportingSourceIds":["fishbase_aohata"],"checkedSourceIds":[],"contradictingSourceIds":[]},"note":"一般生息水深。岸釣り水深へ転用しない。","regionScope":"北西太平洋","unit":"m","rangeType":"bounded_range"},"substrateHabitat":{"value":null,"status":"unknown","confidence":"unknown","evidenceSources":{"supportingSourceIds":[],"checkedSourceIds":[],"contradictingSourceIds":[]},"note":""},"salinityAndWaterBody":{"value":["海水","岩礁性"],"status":"confirmed","confidence":"medium","evidenceSources":{"supportingSourceIds":["fishbase_aohata"],"checkedSourceIds":[],"contradictingSourceIds":[]},"note":"一般生態の説明用途に限定。","regionScope":"北西太平洋","rangeType":"qualitative"},"dayNightTiming":{"value":null,"status":"unknown","confidence":"unknown","evidenceSources":{"supportingSourceIds":[],"checkedSourceIds":[],"contradictingSourceIds":[]},"note":""},"fishingMethods":{"value":null,"status":"unknown","confidence":"unknown","evidenceSources":{"supportingSourceIds":[],"checkedSourceIds":[],"contradictingSourceIds":[]},"note":""},"spawningOrConfusableInfo":{"value":null,"status":"unknown","confidence":"unknown","evidenceSources":{"supportingSourceIds":[],"checkedSourceIds":[],"contradictingSourceIds":[]},"note":""}},"regionalCatchability":{"seasonality":{"value":null,"status":"unknown","confidence":"unknown","evidenceSources":{"supportingSourceIds":[],"checkedSourceIds":[],"contradictingSourceIds":[]},"note":""},"waterTemperature":{"value":null,"status":"unknown","confidence":"unknown","evidenceSources":{"supportingSourceIds":[],"checkedSourceIds":[],"contradictingSourceIds":[]},"note":""},"depthRange":{"value":null,"status":"unknown","confidence":"unknown","evidenceSources":{"supportingSourceIds":[],"checkedSourceIds":[],"contradictingSourceIds":[]},"note":""},"substrateHabitat":{"value":null,"status":"unknown","confidence":"unknown","evidenceSources":{"supportingSourceIds":[],"checkedSourceIds":[],"contradictingSourceIds":[]},"note":""},"salinityAndWaterBody":{"value":null,"status":"unknown","confidence":"unknown","evidenceSources":{"supportingSourceIds":[],"checkedSourceIds":[],"contradictingSourceIds":[]},"note":""},"dayNightTiming":{"value":null,"status":"unknown","confidence":"unknown","evidenceSources":{"supportingSourceIds":[],"checkedSourceIds":[],"contradictingSourceIds":[]},"note":""},"fishingMethods":{"value":null,"status":"unknown","confidence":"unknown","evidenceSources":{"supportingSourceIds":[],"checkedSourceIds":[],"contradictingSourceIds":[]},"note":""},"spawningOrConfusableInfo":{"value":null,"status":"unknown","confidence":"unknown","evidenceSources":{"supportingSourceIds":[],"checkedSourceIds":[],"contradictingSourceIds":[]},"note":""}}},"sources":[{"id":"bismal_aohata","title":"Epinephelus awoara アオハタ","url":"https://www.godac.jamstec.go.jp/bismal/j/view/9004752","publisher":"JAMSTEC BISMaL","publisherType":"public_research","publishedOrUpdatedAt":null,"checkedAt":"2026-07-26","regionScope":"分類・一般生態","sourceType":"supporting","directness":"direct","derivationGroup":"bismal_aohata","supports":["/identity/canonicalNameJa","/identity/scientificName"],"usageNote":""},{"id":"fishbase_aohata","title":"Epinephelus awoara summary page","url":"https://fishbase.org/summary/Epinephelus_awoara.html","publisher":"FishBase","publisherType":"secondary","publishedOrUpdatedAt":null,"checkedAt":"2026-07-26","regionScope":"北西太平洋の一般生態","sourceType":"supporting","directness":"direct","derivationGroup":"fishbase_aohata","supports":["/ecology/stableGeneral/depthRange","/ecology/stableGeneral/salinityAndWaterBody"],"usageNote":""}],"review":{"officialResearch":"公的・研究sourceを優先。","secondaryResearch":"二次sourceは一般生態の補助に限定。","schemaValidation":"v1.3.0自動検証対象。","comparisonWithCurrentImplementation":{"authoritativeComparisonDocument":"docs/research/FISH_SPECIES_ECOLOGY_C_REVIEW.md","scoreV2Status":"unsupported","inheritancePolicy":"do_not_inherit_between_species_or_group"},"attributeDecisions":[{"path":"/identity/canonicalNameJa","decision":"adopt","reason":"根拠の範囲内で採用。SCOREへ自動投影しない。","purposes":["identity_display"],"sourceIds":["bismal_aohata"],"regionScope":"分類情報","confidence":"high","recheckCondition":"source改訂またはSCORE利用時に再確認。"},{"path":"/identity/scientificName","decision":"adopt","reason":"根拠の範囲内で採用。SCOREへ自動投影しない。","purposes":["identity_display"],"sourceIds":["bismal_aohata"],"regionScope":"分類情報","confidence":"high","recheckCondition":"source改訂またはSCORE利用時に再確認。"},{"path":"/identity/aliases","decision":"reject","reason":"alias未評価。","purposes":["score_excluded"],"sourceIds":[],"regionScope":"未確定","confidence":"unknown","recheckCondition":"aliasを直接支えるsource取得時に再確認。"},{"path":"/ecology/stableGeneral/seasonality","decision":"hold","reason":"直接根拠なし。推測補完しない。","purposes":["score_excluded"],"sourceIds":[],"regionScope":"未確定","confidence":"unknown","recheckCondition":"直接source取得時に再確認。"},{"path":"/ecology/stableGeneral/waterTemperature","decision":"hold","reason":"直接根拠なし。推測補完しない。","purposes":["score_excluded"],"sourceIds":[],"regionScope":"未確定","confidence":"unknown","recheckCondition":"直接source取得時に再確認。"},{"path":"/ecology/stableGeneral/depthRange","decision":"adopt_with_warning","reason":"根拠の範囲内で採用。SCOREへ自動投影しない。","purposes":["ecology_description"],"sourceIds":["fishbase_aohata"],"regionScope":"北西太平洋","confidence":"medium","recheckCondition":"source改訂またはSCORE利用時に再確認。"},{"path":"/ecology/stableGeneral/substrateHabitat","decision":"hold","reason":"直接根拠なし。推測補完しない。","purposes":["score_excluded"],"sourceIds":[],"regionScope":"未確定","confidence":"unknown","recheckCondition":"直接source取得時に再確認。"},{"path":"/ecology/stableGeneral/salinityAndWaterBody","decision":"adopt_with_warning","reason":"根拠の範囲内で採用。SCOREへ自動投影しない。","purposes":["ecology_description"],"sourceIds":["fishbase_aohata"],"regionScope":"北西太平洋","confidence":"medium","recheckCondition":"source改訂またはSCORE利用時に再確認。"},{"path":"/ecology/stableGeneral/dayNightTiming","decision":"hold","reason":"直接根拠なし。推測補完しない。","purposes":["score_excluded"],"sourceIds":[],"regionScope":"未確定","confidence":"unknown","recheckCondition":"直接source取得時に再確認。"},{"path":"/ecology/stableGeneral/fishingMethods","decision":"hold","reason":"直接根拠なし。推測補完しない。","purposes":["score_excluded"],"sourceIds":[],"regionScope":"未確定","confidence":"unknown","recheckCondition":"直接source取得時に再確認。"},{"path":"/ecology/stableGeneral/spawningOrConfusableInfo","decision":"hold","reason":"直接根拠なし。推測補完しない。","purposes":["score_excluded"],"sourceIds":[],"regionScope":"未確定","confidence":"unknown","recheckCondition":"直接source取得時に再確認。"},{"path":"/ecology/regionalCatchability/seasonality","decision":"hold","reason":"直接根拠なし。推測補完しない。","purposes":["score_excluded"],"sourceIds":[],"regionScope":"未確定","confidence":"unknown","recheckCondition":"直接source取得時に再確認。"},{"path":"/ecology/regionalCatchability/waterTemperature","decision":"hold","reason":"直接根拠なし。推測補完しない。","purposes":["score_excluded"],"sourceIds":[],"regionScope":"未確定","confidence":"unknown","recheckCondition":"直接source取得時に再確認。"},{"path":"/ecology/regionalCatchability/depthRange","decision":"hold","reason":"直接根拠なし。推測補完しない。","purposes":["score_excluded"],"sourceIds":[],"regionScope":"未確定","confidence":"unknown","recheckCondition":"直接source取得時に再確認。"},{"path":"/ecology/regionalCatchability/substrateHabitat","decision":"hold","reason":"直接根拠なし。推測補完しない。","purposes":["score_excluded"],"sourceIds":[],"regionScope":"未確定","confidence":"unknown","recheckCondition":"直接source取得時に再確認。"},{"path":"/ecology/regionalCatchability/salinityAndWaterBody","decision":"hold","reason":"直接根拠なし。推測補完しない。","purposes":["score_excluded"],"sourceIds":[],"regionScope":"未確定","confidence":"unknown","recheckCondition":"直接source取得時に再確認。"},{"path":"/ecology/regionalCatchability/dayNightTiming","decision":"hold","reason":"直接根拠なし。推測補完しない。","purposes":["score_excluded"],"sourceIds":[],"regionScope":"未確定","confidence":"unknown","recheckCondition":"直接source取得時に再確認。"},{"path":"/ecology/regionalCatchability/fishingMethods","decision":"hold","reason":"直接根拠なし。推測補完しない。","purposes":["score_excluded"],"sourceIds":[],"regionScope":"未確定","confidence":"unknown","recheckCondition":"直接source取得時に再確認。"},{"path":"/ecology/regionalCatchability/spawningOrConfusableInfo","decision":"hold","reason":"直接根拠なし。推測補完しない。","purposes":["score_excluded"],"sourceIds":[],"regionScope":"未確定","confidence":"unknown","recheckCondition":"直接source取得時に再確認。"}],"reviewStatus":"ready_for_review","productionAdoption":{"projectionPolicy":"acceptedPathsのみ投影候補。SCORE未接続。","acceptedPaths":["/identity/canonicalNameJa","/identity/scientificName","/ecology/stableGeneral/depthRange","/ecology/stableGeneral/salinityAndWaterBody"],"unknownPolicy":"unknownを0点・不適へ変換しない。"}}}